{
  "schema_version": "1.0.0",
  "data_version": "1.0.0",
  "program_id": "AIP-9001",
  "program_version": 1,
  "compiler_version": "1.1.0",
  "entry_instruction": "i1",
  "instructions": [
    {
      "instruction_id": "i1",
      "op": "ACTION",
      "master_node_id": "AIA-WAIT",
      "evaluator": "action.wait",
      "params": {}
    }
  ],
  "source_map": {
    "i1": "node-1"
  },
  "limits": {
    "max_steps": 128,
    "max_subroutine_depth": 8
  },
  "content_hash": "0000000000000000000000000000000000000000000000000000000000000000"
}
